rating,date,variation,verified_reviews,feedback,p_verified_reviews
5,2018-05-16,Black,Like new.  No difference from new unused original.,1,like new difference new unused original
5,2018-05-16,Black,"I have no complaints. As far as I know, these are exactly like new, just a little cheaper. Great!",1,complaints far know exactly like new little cheaper great
5,2018-05-16,Black,Perfect condition!,1,perfect condition
5,2018-05-16,Black,Like new,1,like new
5,2018-05-16,White,It works just as well as the new version I got as a discount with my Echo speaker. I decided to purchase this version because Amazon states it has the same warranty.,1,works well new version got discount echo speaker decided purchase version amazon states warranty
5,2018-07-28,Charcoal Fabric ,Very useful,1,useful
5,2018-07-28,Charcoal Fabric ,Great Prime Day Buy!,1,great prime day buy
5,2018-07-28,Charcoal Fabric ,I love Alexa!,1,love alexa
5,2018-07-28,Charcoal Fabric ,Alexa is easy to operate and set up.  Have had it for about 10 days now and love it.,1,alexa easy operate set days love
5,2018-07-28,Heather Gray Fabric ,Great speaker with a lot of capabilities. Very fun to learn how to use it.,1,great speaker lot capabilities fun learn use
5,2018-07-31,Black  Spot,I used the product for my phone to look up the weather and watch videos,1,used product phone look weather watch videos
4,2018-07-31,White  Spot,"Don’t use it for much as I thought we would. Synced with Kasa-Cam and use it to check up on our baby in the crib a lot. Lyrics for music is cool, too. Other than that it’s used as a clock and standard dot’ish features.",1,use much thought would synced kasa cam use check baby crib lot lyrics music cool used clock standard dot ish features
5,2018-07-30,Black  Spot,Amazing so far. Just got it the other day.,1,amazing far got day
4,2018-07-30,Black  Spot,"I like that it's smaller, but it has never understood commands as easily as our first-gen original Echo did.",1,like 's smaller never understood commands easily first gen original echo
4,2018-07-30,Black  Spot,"Worthy successor to the echo dot and right at home in the bed room as an alarm clock.  However, for the price it should come with the stand",1,worthy successor echo dot right home bed room alarm clock however price come stand
5,2018-07-30,Black  Spot,"I love this device! All the functionality of an Amazon Echo with the added benefit of a video screen. It looks great on my nightstand as a clock (lots of faces to choose from) and displays weather, reminders, etc. I think it can do video calls too but I use FaceTime for that anyway. It’s a great shape and doesn’t take up a lot of room. I’m planning to get another one for my guest room. Awesome for a great price!",1,love device functionality amazon echo added benefit video screen looks great nightstand clock lots faces choose displays weather reminders etc think video calls use facetime anyway great shape take lot room planning get another one guest room awesome great price
5,2018-07-30,White  Spot,I love the Echo Spot. This bedside alarm clock size device can do what theEcho Show can do. I was concerned because I already had a large Echo in mybedroom that answered to “Alexa” like the other devices in my home. I wasconcerned about having both devices answering at the same time when I discoveredthat I had other name choices (not enough for me but just enough to avoid confusion).I named him “Echo.” Now if I could only choose a male voice. I loved that I could link it tomy security camera and my new doorbell. So many more features. Don’t forget to buy thestand/base. So many advantages to having that. Read the reviews. Highly recommend.,1,love echo spot bedside alarm clock size device theecho show concerned already large echo mybedroom answered alexa like devices home wasconcerned devices answering time discoveredthat name choices enough enough avoid confusion named echo could choose male voice loved could link tomy security camera new doorbell many features forget buy thestand base many advantages read reviews highly recommend
4,2018-07-30,Black  Spot,"I love this little Spot more than I thought I would. The sound is great for such a little thing...my music plays nice and loud and clear. The video is terrific...I was watching some Prime shows just for the heck of it, and I was really impressed. Immediately convinced my mom to buy my sister one for her birthday!Only thing that kept me from giving it 5 stars...I really wish it was cordless. I love having it in my kitchen but trying to find a place to plug it in is a pain. And it won’t connect to my Bluetooth speaker while playing Amazon Prime Music for some reason, which is a drag when I want to hear it in the dining room during dinner. Of course, if it was CORDLESS I could just bring it with me...otherwise, I absolutely love it and will probably buy another one!",1,love little spot thought would sound great little thing music plays nice loud clear video terrific watching prime shows heck really impressed immediately convinced mom buy sister one birthday thing kept giving stars really wish cordless love kitchen trying find place plug pain connect bluetooth speaker playing amazon prime music reason drag want hear dining room dinner course cordless could bring otherwise absolutely love probably buy another one
5,2018-07-30,Black  Spot,"I bought on Prime Day and so glad I did. It’s easy to use and lots of customization options. I know some reviews said that the screen was small and hard to read, but I disagree.",1,bought prime day glad easy use lots customization options know reviews said screen small hard read disagree
2,2018-07-30,Black  Spot,Honestly I like it but at the same time I don’t I could have bought a smaller one that did the exact same thing for less then half I bought it for the video chat and I have never really used it,0,honestly like time could bought smaller one exact thing less half bought video chat never really used
4,2018-07-30,Black  Spot,"Overall it's great and I like that I can see lyrics and the time and  date. However, sometimes it freezes and doesn't respond properly--no error message about lack of connectivity--it just stops. Resetting resolves the problem.",1,overall 's great like see lyrics time date however sometimes freezes n't respond properly error message lack connectivity stops resetting resolves problem
5,2018-07-30,Black  Spot,I love all that you can do with the Echo Spot!,1,love echo spot
5,2018-07-30,White  Spot,The thing I like most about my Echo Spot is the voice command feature.  You can ask anything and get an answer or play any music without getting up to adjust the Echo. Easy to use,1,thing like echo spot voice command feature ask anything get answer play music without getting adjust echo easy use
5,2018-07-30,White  Spot,"Love it!! Perfect for an alarm clock replacement, plus so much more!!",1,love perfect alarm clock replacement plus much
5,2018-07-30,Black  Spot,"I love the Echo Spot as it is great for checking the weather along with many other things, but most important it works great as your alarm clock in your bedroom!",1,love echo spot great checking weather along many things important works great alarm clock bedroom
5,2018-07-30,White  Spot,We absolutely love this product!!! Wish we would have bought this instead of the dots!!!,1,absolutely love product wish would bought instead dots
5,2018-07-30,White  Spot,"We like that we are able to get weather and other information quickly.  You can even hear music played. The speaker is clear.  We are enjoying it.  What we did not like because it was creepy was that the day before my husband played a particular song on our stereo for me.  The next day, I asked the Echo to play music from the same artist not specifying any particular song.  The Echo played the exact song by that same artist that my husband played on our stereo the day before.  It was a little disconcerting.",1,like able get weather information quickly even hear music played speaker clear enjoying like creepy day husband played particular song stereo next day asked echo play music artist specifying particular song echo played exact song artist husband played stereo day little disconcerting
4,2018-07-30,White  Spot,"I like echo spot. I bought it to use as an alarm clock. One negative that i didnt really think about, when you wake up in the morning and are somewhat groggy, its hard to tell alexa to turn off the alarm, or hard to remember commands to snooze for a few minutes. In this case a clock with buttons seems to work better",1,like echo spot bought use alarm clock one negative didnt really think wake morning somewhat groggy hard tell alexa turn alarm hard remember commands snooze minutes case clock buttons seems work better
5,2018-07-30,White  Spot,This is our second Echo Spot - to go with out two Echo Dots - love the look and how Alexia responds.,1,second echo spot go two echo dots love look alexia responds
5,2018-07-30,Black  Spot,Love my Echo Spot!,1,love echo spot
1,2018-07-30,Black  Spot,It is very slow compared to the echo,0,slow compared echo
5,2018-07-30,White  Spot,I love the way it is designed. And you have choices for the face.  I use it for my bed side.  I drop in; on my echo in another part of the house frequently without yelling.,1,love way designed choices face use bed side drop echo another part house frequently without yelling
4,2018-07-30,Black  Spot,"Terrific sound for a small device, and nice form factor for the nightstand. I like the convenience of seeing the time and temperature rather than asking Alexa. Not using video much, but it would be nice if the device had a square/rectangular screen.",1,terrific sound small device nice form factor nightstand like convenience seeing time temperature rather asking alexa using video much would nice device square rectangular screen
5,2018-07-30,Black  Spot,New to Alexa. Like this spot a lot.,1,new alexa like spot lot
4,2018-07-30,Black  Spot,"It's not perfect, but I really like this little gizmo. i bought it primarily for 2 purposes. First, so I could set wake-up alarms by individual days, and set the wake-up music individually by the day. Second, I wanted to control a bedroom light by voice, so I could shut it off as I was falling asleep, without having to get out of bed to turn a switch. The Echo Spot, together with a smart plug,has been able to accomplish that. A bonus has been getting Alexa to play music from my Amazon Prime playlists.What's not so great is that sometimes Alexa has a really hard time understanding instructions, and repeating and altering the way you say things can get pretty frustrating. Hopefully the AI gets better in the future, along with added functions.",1,'s perfect really like little gizmo bought primarily purposes first could set wake alarms individual days set wake music individually day second wanted control bedroom light voice could shut falling asleep without get bed turn switch echo spot together smart plug able accomplish bonus getting alexa play music amazon prime playlists 's great sometimes alexa really hard time understanding instructions repeating altering way say things get pretty frustrating hopefully ai gets better future along added functions
5,2018-07-30,White  Spot,I love it.  It is so easy to use,1,love easy use
5,2018-07-30,Black  Spot,Put this on my night stand to use as a clock and alarm. Works great. Every morning I get the weather and news when I get up. Also reminds me of all the appointments my wife and I have.,1,put night stand use clock alarm works great every morning get weather news get also reminds appointments wife
5,2018-07-30,Black  Spot,Love it,1,love
3,2018-07-30,White  Spot,"Part of it is my fault, I thought it could be wireless.  Though for the price, I still feel like it should be. Also the sound quality and volume could be better. I prefer the tap. Unless you really want to have the call options but today most of us have phones, computers or iPads. Just not worth it.",1,part fault thought could wireless though price still feel like also sound quality volume could better prefer tap unless really want call options today us phones computers ipads worth
5,2018-07-30,Black  Spot,Very easy to use and much quicker then looking up everything on the cell phone.,1,easy use much quicker looking everything cell phone
5,2018-07-30,Black  Spot,I love my new Echo Spot!,1,love new echo spot
5,2018-07-30,Black  Spot,"I love this clock, I just have to tell it to set my alarm.  No more fussing with buttons!",1,love clock tell set alarm fussing buttons
5,2018-07-30,Black  Spot,Couldn't be more pleased. Amazon hit this one out of the park. Looks great and runs great. Love it!,1,could n't pleased amazon hit one park looks great runs great love
5,2018-07-30,White  Spot,Responds easily and like the ability to do at night.,1,responds easily like ability night
5,2018-07-30,Black  Spot,Easy setup  Love it!,1,easy setup love
5,2018-07-30,White  Spot,"Simply amazing what a awsome device. It never ceases to amaze me, wake up to big bang music, go to sleep softly falling rain. Drop in on the kids and keep in touch. I have just scratched the surface as to what this devise can do.",1,simply amazing awsome device never ceases amaze wake big bang music go sleep softly falling rain drop kids keep touch scratched surface devise
4,2018-07-30,Black  Spot,"I was skeptical at first but &#34;it&#34; grows on you.  It looks good, so far.  I did, however, turn off the camera.",1,skeptical first grows looks good far however turn camera
4,2018-07-30,Black  Spot,Sound quality is disappointing.,1,sound quality disappointing
5,2018-07-30,White  Spot,I love it!  I especially love that it is so small and does so much.  Got rid of my old CD/Alarm clock radio.  Much more room on nightstand.,1,love especially love small much got rid old cd alarm clock radio much room nightstand
5,2018-07-30,White  Spot,Great sound and video plus all the great stuff that Alexa has to offer even turns my lights on and off,1,great sound video plus great stuff alexa offer even turns lights
4,2018-07-30,Black  Spot,The ease to use product,1,ease use product
4,2018-07-30,Black  Spot,"So far pretty happy with the Spot. For me it really is a glorified alarm clock/radio and I know I could have something more cost effective but eh, I like it. I had read the reviews about the scrolling issues and saw the one about how to make that stop and it did. So far so good.",1,far pretty happy spot really glorified alarm clock radio know could something cost effective eh like read reviews scrolling issues saw one make stop far good
5,2018-07-30,Black  Spot,"I am just entering the &#34;smart&#34; technology world. I haven't figured it all out yet, but so far it's pretty cool!",1,entering smart technology world n't figured yet far 's pretty cool
5,2018-07-30,Black  Spot,"It was smaller than I had anticipated, and when I say that I very much mean it. However, it still works very well! Quality sound, easily programmed, easy to work with, but Alexa is not anywhere as good as other voice programs.",1,smaller anticipated say much mean however still works well quality sound easily programmed easy work alexa anywhere good voice programs
5,2018-07-30,White  Spot,Love my Echo Spot!,1,love echo spot
5,2018-07-30,Black  Spot,"Great deal, great product!",1,great deal great product
5,2018-07-30,Black  Spot,Perfect,1,perfect
5,2018-07-30,Black  Spot,"i had a couple of echo dots previously - bought these _SPECIFICALLY_ for the Ring doorbell video / cloud cam display / interface capabilities. WAS NOT DISAPPOINTED. Love the fact that I can ask to see front yard / back yard / front door, etc.the video chat with the other rooms is also quite cool.BONUS: “Alexa show me Ant Man trailer, etc”i know this can all be done on laptop/desktop, but it’s cool now having an ‘appliance’ that’s always just there, and it doesn’t interrupt what i’m doing.",1,couple echo dots previously bought specifically ring doorbell video cloud cam display interface capabilities disappointed love fact ask see front yard back yard front door etc video chat rooms also quite cool bonus alexa show ant man trailer etc know done laptop desktop cool appliance always interrupt
5,2018-07-30,White  Spot,"Bought this for my bedroom and the Show for my living room. Love them both. The Spot is perfect for bedside and has an impressive design. Shows lyrics, photos , etc. I paired it with a Smart Plug for the bedroom lamps &#34;Alexa, turn off lights&#34;, love it.",1,bought bedroom show living room love spot perfect bedside impressive design shows lyrics photos etc paired smart plug bedroom lamps alexa turn lights love
5,2018-07-30,Black  Spot,Love that is can do so much! It sits on my nightstand! Only improvements I would make is having battery back up capability and the screen could be a tad bigger. But overall I’m happy I have it! Would recommend!,1,love much sits nightstand improvements would make battery back capability screen could tad bigger overall happy would recommend
4,2018-07-30,Black  Spot,It was a gift and the recipient love love loves it 😍💋💋💋💋❤!,1,gift recipient love love loves
5,2018-07-30,Black  Spot,"Cool little piece of tech...we’re still learning some of its functions and possibilities, but I can see some potential.  Even my ‘technically challenged’ wife already figured out how to video call our daughter.",1,cool little piece tech still learning functions possibilities see potential even technically challenged wife already figured video call daughter
5,2018-07-30,Black  Spot,"I have been extremely impressed with the device as a whole. Completely changed sleep schedule and replaced my alarm clock. It is the perfect bedside counter device - alarm, wake up music, weather, top news stories, etc. Perfect device for what I wanted and does so much more than I expected it to do, calling feature is also a huge selling point. This is a must own item. Probably will grab more Echos in the future.",1,extremely impressed device whole completely changed sleep schedule replaced alarm clock perfect bedside counter device alarm wake music weather top news stories etc perfect device wanted much expected calling feature also huge selling point must item probably grab echos future
2,2018-07-30,Black  Spot,"As an Alexa device, it works just as well as any of the other products.  Unfortunately it doesn't go up from there.  The ability to play videos is very limited.  You CAN NOT play YouTube and when you can play a video the cropping of the screen makes it look very strange. There is quite a selection of clock faces, and you can control what is displays with one glaring and VERY ANNOYING exception.  You can't turn off the &#34;Things to try&#34; screen You can turn off the screen scroll, but that defeats the purpose of having the screen.  I don't need to be reminded every 5 seconds what things I can do with Alexa.  I don't need the advertising, especially at the cost of this device.  Overall, its an expensive Alexa device with a screen that's not very useful and annoying.  I would not recommend this until the Amazon people get their act together and come up with a screen that's actually useful.",0,alexa device works well products unfortunately n't go ability play videos limited play youtube play video cropping screen makes look strange quite selection clock faces control displays one glaring annoying exception ca n't turn things try screen turn screen scroll defeats purpose screen n't need reminded every seconds things alexa n't need advertising especially cost device overall expensive alexa device screen 's useful annoying would recommend amazon people get act together come screen 's actually useful
5,2018-07-30,White  Spot,So far so good.,1,far good
5,2018-07-30,Black  Spot,"This device is perfect for a smart nightstand clock. I love how it dims based on the ambient light in the room. Its the first nightstand clock I have had in my bedroom in years because the lighting and glow from typical alarm clocks bother me when trying to sleep. The screen on this dims when the lights in the room go out and is not bothersome at all.Overall a great addition to my smart home. Its nice to be able to tell Alexa to turn on/off the bedroom lights without even getting out of bed or reaching for your phone. I have a bunch of other Alexa devices, but this was the first one with a screen.",1,device perfect smart nightstand clock love dims based ambient light room first nightstand clock bedroom years lighting glow typical alarm clocks bother trying sleep screen dims lights room go bothersome overall great addition smart home nice able tell alexa turn bedroom lights without even getting bed reaching phone bunch alexa devices first one screen
5,2018-07-30,White  Spot,"I love this thing. I talk to it through walls and in other rooms. I have been an amazon lover for a while so I have amazon music unlimited, kindle unlimited, prime video, etc., so I was ready for this when it came out. The screen is just so nice to have.The only thing resembling a down side is that it doesn't always perfectly understand which song I want to hear, but I do have a deep southern accent, lower Alabama, so I don't speak English anyways.",1,love thing talk walls rooms amazon lover amazon music unlimited kindle unlimited prime video etc ready came screen nice thing resembling side n't always perfectly understand song want hear deep southern accent lower alabama n't speak english anyways
4,2018-07-30,Black  Spot,Smaller than I thought it would be. Happy I got a stand so it sits up higher on the bedside table.,1,smaller thought would happy got stand sits higher bedside table
4,2018-07-30,White  Spot,Echo Spot works well except it does not work with the Ring doorbell as it states on the website. Since they were sold as a pair I thought that it would be app ready.  Unfortunately that is not case.  Perhaps Ring will update so that they can be integrated.,1,echo spot works well except work ring doorbell states website since sold pair thought would app ready unfortunately case perhaps ring update integrated
5,2018-07-30,Black  Spot,Nice,1,nice
5,2018-07-30,Black  Spot,I like it,1,like
5,2018-07-30,White  Spot,"We've owned a number of Echo devices, but have viewed them as more of a toy than a tool.  Other than playing music through a sound system, we haven't found much use for them.  We just don't find the voice user interface to be all that efficient.  The Echo Spot solves the efficiency problem by displaying the information that you're routinely interested in.  Furthermore, you can do some basic navigation using the touch screen as well as tailor the settings.  We now use these as bedside clocks.",1,'ve owned number echo devices viewed toy tool playing music sound system n't found much use n't find voice user interface efficient echo spot solves efficiency problem displaying information 're routinely interested furthermore basic navigation using touch screen well tailor settings use bedside clocks
5,2018-07-30,White  Spot,I love my Echo Spot.  Waking to my favorite music.  Being able to completely turn off display at night so my bedroom is dark.  All the skills I have yet to try.  Easy to use.,1,love echo spot waking favorite music able completely turn display night bedroom dark skills yet try easy use
4,2018-07-30,Black  Spot,"I like how small it is, but I’m still able to see my Ring cameras.",1,like small still able see ring cameras
5,2018-07-30,Black  Spot,Great for checking in on my son after school when I'm still at work.  Love getting the weather and traffic in the morning so I can plan my route accordingly,1,great checking son school 'm still work love getting weather traffic morning plan route accordingly
5,2018-07-30,Black  Spot,Love it!! Super fun! Easy to use! My three year old even gets involved,1,love super fun easy use three year old even gets involved
1,2018-07-30,White  Spot,I returnef this item because it does not speak Spanish,0,returnef item speak spanish
4,2018-07-29,Black  Spot,"I am a hardcore fan of Echo. Infact I am in love with all members of my Alexa family. I have Echo, Echo Dot, Echo Plus and now this new toddler Echo Spot. Every variant has its own beauty. I love feel and size of Echo Spot. It’s fabulous as far as looks are concerned. It does not have great Audio quality (which I did not expect at the time of placing order because of its compact and small size). I bought it to connect with my Bose SoundTouch.",1,hardcore fan echo infact love members alexa family echo echo dot echo plus new toddler echo spot every variant beauty love feel size echo spot fabulous far looks concerned great audio quality expect time placing order compact small size bought connect bose soundtouch
5,2018-07-29,Black  Spot,Love this!,1,love
5,2018-07-29,Black  Spot,I love being able to have Alexa sing careless whisper into my ear to wake me up.,1,love able alexa sing careless whisper ear wake
3,2018-07-29,White  Spot,"Works great as a bedside clock but the microphone for Alexa doesn't work as well as the normal Echo.  Sometimes Alexa doesn't hear me when I try to interrupt her it to give new instructions.  The speaker also isn't as good as the normal Echo.  Screen is small so not really useful for viewing any type of video or for seeing who's at the front door.  But, it's great for the bedside.",1,works great bedside clock microphone alexa n't work well normal echo sometimes alexa n't hear try interrupt give new instructions speaker also n't good normal echo screen small really useful viewing type video seeing 's front door 's great bedside
5,2018-07-29,Black  Spot,Fun tech toy,1,fun tech toy
5,2018-07-29,Black  Spot,Love it. Small with good sound,1,love small good sound
