rating,date,variation,verified_reviews,feedback,p_verified_reviews
4,2018-07-30,Black  Show,"Great addition to the Alexa family, just wish it could use the screen more than backgrounds. Don't get me wrong I don't regret buying it especially for the primeday sale of $100 off sale price but for now the skills for the show are lacking.",1,great addition alexa family wish could use screen backgrounds n't get wrong n't regret buying especially primeday sale sale price skills show lacking
5,2018-07-30,Black  Show,I've had previous experience with the echo Dot and this just blows all previous expectations out of the water!It's great since it can play videos and music from multiple sources and the speakers are pretty loud.,1,'ve previous experience echo dot blows previous expectations water 's great since play videos music multiple sources speakers pretty loud
5,2018-07-30,White  Show,"Love the echo show, can keep I can video chat with the kids and grandkids. I have it in the kitchen, so when I run out of something I have Alexa to add it to my grocery list. I use it for everything. Was very easy to set up",1,love echo show keep video chat kids grandkids kitchen run something alexa add grocery list use everything easy set
4,2018-07-30,Black  Show,I’m really hoping for skills that take advantage of the shows touch screen. There’s an incredible amount of untapped potential locked behind the restrictions. Make use of the best part of having the show and enable skills to navigate by touch please!,1,really hoping skills take advantage shows touch screen incredible amount untapped potential locked behind restrictions make use best part show enable skills navigate touch please
5,2018-07-30,Black  Show,Love it l. I plan on getting an echo for the kitchen.,1,love l plan getting echo kitchen
3,2018-07-30,Black  Show,It does not pick up my voice unless I yell most times.,1,pick voice unless yell times
5,2018-07-30,White  Show,great love it,1,great love
5,2018-07-30,Black  Show,Amazing!,1,amazing
1,2018-07-30,Black  Show,Fire HD does so much more.  Over priced pair of speakers.,0,fire hd much priced pair speakers
3,2018-07-30,Black  Show,"Seems to be a good product but, unable to play music in sync with my Sonos system. Sonos doesn't seem to recognize it at all.",1,seems good product unable play music sync sonos system sonos n't seem recognize
5,2018-07-30,Black  Show,Great product.  Like the apps that I can connect to it.,1,great product like apps connect
5,2018-07-30,Black  Show,I love it now able to talk to my grandson with ease and the picture quality is great,1,love able talk grandson ease picture quality great
5,2018-07-30,Black  Show,"Love it! Easy setup and I can ‘Drop in’ on my daughter and son-in-law who live in St. Louis anytime. Everyone loves to have their mother drop in, right 😎",1,love easy setup drop daughter son law live st louis anytime everyone loves mother drop right
5,2018-07-30,Black  Show,Fun,1,fun
4,2018-07-30,White  Show,I use this to control my smart home.,1,use control smart home
4,2018-07-30,Black  Show,"Show has been great. Still learning what it can do, but being able to watch videos, talk face to face with others are not features.",1,show great still learning able watch videos talk face face others features
5,2018-07-30,Black  Show,Wish I bought one for work too,1,wish bought one work
1,2018-07-30,Black  Show,"Very intrusive, so I turn it off",0,intrusive turn
5,2018-07-30,White  Show,Love the echo show,1,love echo show
4,2018-07-30,Black  Show,Works well. Not thrilled that most of the apps have to be paid for seprately.,1,works well thrilled apps paid seprately
4,2018-07-30,Black  Show,Video calls to Mom,1,video calls mom
5,2018-07-30,White  Show,"Love being able to see, as well as hear things.  Sound is better, too!",1,love able see well hear things sound better
5,2018-07-30,Black  Show,I love it,1,love
5,2018-07-30,Black  Show,Just like any other echo. Doesn’t disappoint,1,like echo disappoint
4,2018-07-30,Black  Show,"Nice picture good sound but the mics are not as sensitive as a dot, my dots can hear me from across the house the Show does not, that being said I LOVE the show!!I can watch TV and movies while in tg ed kitchen, have the News playing or Music....love....it !!",1,nice picture good sound mics sensitive dot dots hear across house show said love show watch tv movies tg ed kitchen news playing music love
4,2018-07-30,White  Show,"I basically use it to play music  and tell me the news..its sometimes hard to communicate with it, if i dont say the command correctly, but i realize its learning my style of speaking and will do some commands even though i dont say them exactly as i should.",1,basically use play music tell news sometimes hard communicate dont say command correctly realize learning style speaking commands even though dont say exactly
5,2018-07-30,White  Show,Upgraded from echo to echo show.,1,upgraded echo echo show
5,2018-07-30,Black  Show,"I love the Echo Show!! I have the dot and have been using that for the last 6 months,  but the Show is so much better.  The sound quality is amazing and the screen resolution is like watching a mini 4K tv.  I love being able to see my timers, events and list instead of having them read to me.  I purchased this on prime day, and it is worth every penny.  When the dot was given to me, I thought ""this is a cute novelty,  but I'll probably never use it"". Was I wrong!!  Echo is part of my daily routine,  and has made my life so much easier.",1,love echo show dot using last months show much better sound quality amazing screen resolution like watching mini k tv love able see timers events list instead read purchased prime day worth every penny dot given thought cute novelty 'll probably never use wrong echo part daily routine made life much easier
5,2018-07-30,Black  Show,"So far I’m very pleased with my Echo Show.  The problem is, there’s so much it can do that I haven’t been able to explore the extent of its abilities! I got the special price as part of the Prime Day promotion...and you just can’t beat what you get for the price.  Very pleased with the sound. The video screen is sharp. Sometimes it takes a few tries to get Alexa to perform a command...but as I get to know the system better, I’m hoping that will improve.  One drawback in the music...I’ve noticed a lot of the songs from years past, are re-recordings by the original artist...but not the original recording itself.  Example: Secret Agent Man by Johnny Rivers...a “live”version is used, not the original version.  If I’m going to pay for Prime Music...I’d like to hear the original version of songs...not later recordings.  Or at least give me a choice of what I want to hear.  Otherwise, I am very pleased with my Echo Show.  So pleased in fact, that I bought a second one!",1,far pleased echo show problem much able explore extent abilities got special price part prime day promotion beat get price pleased sound video screen sharp sometimes takes tries get alexa perform command get know system better hoping improve one drawback music noticed lot songs years past recordings original artist original recording example secret agent man johnny rivers live version used original version going pay prime music like hear original version songs later recordings least give choice want hear otherwise pleased echo show pleased fact bought second one
5,2018-07-30,Black  Show,"I like everything, about this ! Im still learning how to use it!",1,like everything im still learning use
2,2018-07-29,Black  Show,"It's like having another kid in the house; I have to constantly repeat myself.I can tell Alexa to do something clear as day, and according to the history, she hears something comeletely different.The device is really cool, and I like the concept, which is why it gets two stars. However, it just doesn't work as intended.I find myself irritated more often than not when I use this device.",0,'s like another kid house constantly repeat tell alexa something clear day according history hears something comeletely different device really cool like concept gets two stars however n't work intended find irritated often use device
5,2018-07-29,White  Show,Really easy to use,1,really easy use
5,2018-07-29,White  Show,It's great sound and video quality,1,'s great sound video quality
1,2018-07-29,Black  Show,The way the music sounds is poor quality,0,way music sounds poor quality
4,2018-07-29,Black  Show,"It does everything the Echo does, and more. Although I haven't and probably won't use the video functions. I had hoped that the display would be allow for more customization. It does not and is very limited. I would like the clock and weather to display in large text all of the time, it only displays in very small text. It also always has a line that says &#34;Tell Alexa to do this, or that&#34;, tips at the bottom of the screen. I would like to see that go away, but it won't. Sound quality is good, not as good as the big Echo, but good enough. I bought it on sale and think I got value for what I paid. I would have been disappointment had I of paid full price.",1,everything echo although n't probably wo n't use video functions hoped display would allow customization limited would like clock weather display large text time displays small text also always line says tell alexa tips bottom screen would like see go away wo n't sound quality good good big echo good enough bought sale think got value paid would disappointment paid full price
5,2018-07-29,Black  Show,Love my echo show!,1,love echo show
4,2018-07-29,Black  Show,I enjoy this thing. Its learning,1,enjoy thing learning
5,2018-07-29,Black  Show,Am very happy now that i can see.,1,happy see
2,2018-07-29,Black  Show,All of my echo devices stopped communicating properly with Sonos devices upon connecting the echo show to my account. Asking any echo device to play music on Sonos baffled the system that had previously worked flawlessly. This went on for two weeks until I eventually solved the problem that neither Amazon nor Sonos could figure out.,0,echo devices stopped communicating properly sonos devices upon connecting echo show account asking echo device play music sonos baffled system previously worked flawlessly went two weeks eventually solved problem neither amazon sonos could figure
5,2018-07-29,White  Show,"So far, I like it.  It is better than I expecting it.",1,far like better expecting
4,2018-07-29,Black  Show,Doesn't always respond to the wake word. This is my 3rd echo product and I have to say I am A little disappointed. Alexa voice assistant is great when it comes to controlling a connected home but has a lot to learn from google assistant when it comes to  getting answers for search queries.,1,n't always respond wake word rd echo product say little disappointed alexa voice assistant great comes controlling connected home lot learn google assistant comes getting answers search queries
4,2018-07-29,Black  Show,Good product.,1,good product
3,2018-07-29,Black  Show,"After two weeks I am not sure if I like the ever present Alexa to have a screen as well.  I bought it to be a abay monitor combined with a wifi camera, and that works.  But the screen is always on unless you tell it to turn it off - instead of just a talking cylinder you now have a mini screen that not only talks to you but also writes out everything it says or shows accompanying video.  There is something about only audio that made Alexa different, no I some ways it is a TV that you can talk to.",1,two weeks sure like ever present alexa screen well bought abay monitor combined wifi camera works screen always unless tell turn instead talking cylinder mini screen talks also writes everything says shows accompanying video something audio made alexa different ways tv talk
1,2018-07-29,Black  Show,It f****** sucks,0,f sucks
5,2018-07-29,White  Show,Love being able to read the lyrics of my favorite songs.,1,love able read lyrics favorite songs
5,2018-07-29,Black  Show,"This thing is awesome for grocery lists, paired with the AnyList app. The flash briefing is very good too. My only complaint is that once you pause something, Alexa decides that you no longer want to listen to that thing. Forever. All in all, definitely worth the purchase.",1,thing awesome grocery lists paired anylist app flash briefing good complaint pause something alexa decides longer want listen thing forever definitely worth purchase
5,2018-07-29,Black  Show,"Works great, video call function nice when communicating through drop-in",1,works great video call function nice communicating drop
5,2018-07-29,Black  Show,As you can see Echo Show is in kitchen. It far exceeds my expectation. There’s a wealth of information about any topic. If is customizable for sound and video. I also have Echo and Echo Dot. You can group them and have hole house music. Still not done exploring all it can do love it. Perfect for getting recipes so you can see them while you’re preparing to cook.,1,see echo show kitchen far exceeds expectation wealth information topic customizable sound video also echo echo dot group hole house music still done exploring love perfect getting recipes see preparing cook
4,2018-07-29,Black  Show,Fairly easy to use,1,fairly easy use
5,2018-07-29,Black  Show,Absolutely LOVE my Echo Show!  It is awesome and works great with my Ring Video Spotlight Cams!  Music on demand and so many more features that I have yet to explore!!!,1,absolutely love echo show awesome works great ring video spotlight cams music demand many features yet explore
5,2018-07-29,White  Show,Absolutely love it! I use it for everything!I tell my friends and clients that it’s the daughter I never had. I ask her to do something and she doesn’t complain! I wish I bought the 2package deal :( I truly needed one in my work room. I kick myself for it.,1,absolutely love use everything tell friends clients daughter never ask something complain wish bought package deal truly needed one work room kick
5,2018-07-29,White  Show,"We love having this in our kitchen! Very convenient to look up recipes, listen to the news, or watch prime video while I'm cooking",1,love kitchen convenient look recipes listen news watch prime video 'm cooking
1,2018-07-29,White  Show,"Always wanted one,till I got one, it's not at all what it's cracked up to be, it's hard to navigate I actually like the dot better.",0,always wanted one till got one 's 's cracked 's hard navigate actually like dot better
5,2018-07-29,Black  Show,The greatest,1,greatest
5,2018-07-29,Black  Show,Love it,1,love
5,2018-07-29,Black  Show,This is my fourth Echo (original and two dots). It's the best.... Decent speaker... Fun graphics...,1,fourth echo original two dots 's best decent speaker fun graphics
5,2018-07-29,Black  Show,I loved talking it out of the box and being able to easily set up.,1,loved talking box able easily set
5,2018-07-29,Black  Show,Easy to setup and use. The ability to play video is huge addition on Alexa device family,1,easy setup use ability play video huge addition alexa device family
2,2018-07-29,Black  Show,"Echo Show is said to work with certain apps but,NOT!!! Cozi state works with Echo Show, but the Cozi Family’s doesn’t very well, Amazon needs to go back to drawing board, it would be such a needed piece of technology, but it lacks the essential, please fix. Cost of the Echo Show was  marvelous . Got Echo Show to take on shopping list but that is all so far, adding items to list has long lag, and it not my router being slow, my provider speed is !GB, speed not a problem, but before new items is updated on Cozi is very slow. Help is needed to get it updated to A1 working conditioning.",0,echo show said work certain apps cozi state works echo show cozi family well amazon needs go back drawing board would needed piece technology lacks essential please fix cost echo show marvelous got echo show take shopping list far adding items list long lag router slow provider speed gb speed problem new items updated cozi slow help needed get updated working conditioning
4,2018-07-29,Black  Show,"All the music I can listen too, Also the movie I can watch I can see my ring doorbell .",1,music listen also movie watch see ring doorbell
5,2018-07-29,Black  Show,No enough video options,1,enough video options
4,2018-07-29,White  Show,Great sound,1,great sound
4,2018-07-29,Black  Show,I took advantage of prime Friday and decided to take a chance and purchase one.  I enjoy the features it comes with. I'm sorry I didn't purchase two of them  Well worth the money.  Its looks great on my nightstand.  Every night it puts me to steep with sleeping music.  Happy customer!,1,took advantage prime friday decided take chance purchase one enjoy features comes 'm sorry n't purchase two well worth money looks great nightstand every night puts steep sleeping music happy customer
5,2018-07-29,Black  Show,The music...the shopping list and the sound....,1,music shopping list sound
5,2018-07-29,Black  Show,"diversity, so many things to see and hear. Wealth of information",1,diversity many things see hear wealth information
5,2018-07-29,Black  Show,Love it. Thanks Amazon. You guys rock!!,1,love thanks amazon guys rock
2,2018-07-29,Black  Show,"Disappointed that this device Is not able to access youtube as of Dec 2017. I wasn’t aware of that when I purchased it. I’ve had problems with my device. The voice stops working throughout the day. I can see it trying to respond to me, because the window it opens contains the info I asked about, but it’s like the device gets stuck in the process. It stops working, and the blue bar just flashes. I keep having to unplug and restart the device. Once I do that, it starts working again. So irritating. This device could really be a great device if Google and Amazon would act like grownups...",0,disappointed device able access youtube dec aware purchased problems device voice stops working throughout day see trying respond window opens contains info asked like device gets stuck process stops working blue bar flashes keep unplug restart device starts working irritating device could really great device google amazon would act like grownups
1,2018-07-29,Black  Show,Returned from repair with No repair done. It has a problem which requires it to be on for a while for the defective part to show itself.I sent it for repair and got it back without being fixed.  The site gives no option to complain from the page.I have a echo spot which works perfectly in the same position.,0,returned repair repair done problem requires defective part show sent repair got back without fixed site gives option complain page echo spot works perfectly position
5,2018-07-29,Black  Show,Love it!,1,love
5,2018-07-29,Black  Show,I like the design and the visuals!,1,like design visuals
5,2018-07-29,Black  Show,"I haven't had my show very long or used it a lot, but I love it! I use it to set timers when cooking because my stove is being finicky and not wanting to work most of the time. I also use it to check for different recipes, listen to music and my all time favorite.... telling everyone it is time for dinner. My son gets a real kick out of that!I know a lot of people are expecting more out of their shows then it is possible to at the moment, but remember the original echo didn't have what it has now when it first came out. I see that Amazon is adding new stuff all the time and soon I am sure it will have all that we want very soon.... maybe even things we haven't thought of!I do wish it was a bit more user friendly. I still haven't figured out how to video chat with my cousin in North Carolina who also has one, and when I tried to call my son's dot it went to video chat immediately, last I looked, dots don't have video screens!Another thing that needs to be addressed is when my husband tried to have the one in our bedroom play thunderstorm sounds to help him go to sleep, it tried to get him to buy an app instead of playing the skill I had enabled that was free. So now he is a bit worried to use it again. That needs to be fixed.I do have to say that all in all I am very happy with my Echo Show!",1,n't show long used lot love use set timers cooking stove finicky wanting work time also use check different recipes listen music time favorite telling everyone time dinner son gets real kick know lot people expecting shows possible moment remember original echo n't first came see amazon adding new stuff time soon sure want soon maybe even things n't thought wish bit user friendly still n't figured video chat cousin north carolina also one tried call son 's dot went video chat immediately last looked dots n't video screens another thing needs addressed husband tried one bedroom play thunderstorm sounds help go sleep tried get buy app instead playing skill enabled free bit worried use needs fixed say happy echo show
5,2018-07-29,White  Show,I have not had it very long. It's my first Alexa thing. I sure like what I have done with it so far there is a lot to learn and play with,1,long 's first alexa thing sure like done far lot learn play
5,2018-07-29,Black  Show,Works great and has been fun to use.,1,works great fun use
5,2018-07-29,White  Show,This is the best of my echo devices and I own a spot a dot and echo,1,best echo devices spot dot echo
4,2018-07-29,Black  Show,Having the large screen really majes this an enjoyable experience. Only thing it’s missing is youtube.,1,large screen really majes enjoyable experience thing missing youtube
5,2018-07-29,Black  Show,easy to use.,1,easy use
3,2018-07-29,White  Show,"I bought it to go with my security camera system, but it did not perform like I thought it would. It doesn't alert us when someone is at the door. Also, I can't talk to the person at the door through the echo show, only through my cell phone.",1,bought go security camera system perform like thought would n't alert us someone door also ca n't talk person door echo show cell phone
1,2018-07-29,Black  Show,"Great device, features are awesome, the interaction is fantastic. Home automation works perfect if you link up your accounts correctly. My only issue is out of (4) Echo Shows (2) of them have been sent off for repair because of the screen glitching!! These are less than 3 months old and already having issues!First repairs were sent off and they “updated the firmware” when I got the device back nothing worked, I had to update to the newest firmware for it to work again. Then (2) weeks later the glitch starts up again!I love the show but I’m getting really frustrated with the glitching.",0,great device features awesome interaction fantastic home automation works perfect link accounts correctly issue echo shows sent repair screen glitching less months old already issues first repairs sent updated firmware got device back nothing worked update newest firmware work weeks later glitch starts love show getting really frustrated glitching
5,2018-07-29,Black  Show,Super fun !! I ty is what I was expecting,1,super fun ty expecting
5,2018-07-29,White  Show,I love this so much!! Alexa is even better when she can show you things!,1,love much alexa even better show things
5,2018-07-29,Black  Show,I have the echo but got 2 show. 1 for my Daughter. Absolutely love it. Especially for the video chat.,1,echo got show daughter absolutely love especially video chat
5,2018-07-29,Black  Show,"I've had an Alexa Dot for some time but I'm really enjoying the Alexa Show. It's great to have a visual whether it's a song or the weather. Played Jeapordy, but I'm not good at it. You do learn trivia and no one's watching! Love that recipes are visible and movies are available. Haven't had it long enough to try everything.",1,'ve alexa dot time 'm really enjoying alexa show 's great visual whether 's song weather played jeapordy 'm good learn trivia one 's watching love recipes visible movies available n't long enough try everything
5,2018-07-29,Black  Show,Got this on Amazon prime with the ring pro. Work really great. Being the lazy guy I am I don't need to go see who at my door anymore while I'm gaming.,1,got amazon prime ring pro work really great lazy guy n't need go see door anymore 'm gaming
5,2018-07-29,Black  Show,"We originally got the Show to video chat family members, and it works great for that. We have found that we really like checking things hands-free like the weather and recipes. So far we have really liked the Show, and would recommend it!",1,originally got show video chat family members works great found really like checking things hands free like weather recipes far really liked show would recommend
5,2018-07-29,Black  Show,Easy setup. Was up and running in minutes. The learning feature is outstanding. Now I know why Amazon is so far ahead of the competition.,1,easy setup running minutes learning feature outstanding know amazon far ahead competition
